{
  "type": "ApplicationInsights",
  "labels": {
    "fr": "Application Insights",
    "en": "Application Insights"
  },
  "category": "observability",
  "icon": "application-insights",
  "armType": "Microsoft.Insights/components",
  "availableFrom": "lot1",
  "documentationUrl": "https://learn.microsoft.com/en-us/azure/templates/microsoft.insights/components",
  "verifiedAgainstDocsOn": "2026-10-27",
  "naming": {
    "abbreviation": "appi",
    "allowed": "^[^%&\\?/:]{1,260}$",
    "case": "mixed",
    "separators": [],
    "forbidConsecutiveSeparators": true,
    "minLength": 1,
    "maxLength": 260,
    "firstChar": "alphanumeric",
    "lastChar": "alphanumeric",
    "uniqueness": "resourceGroup",
    "availabilityDomain": null
  },
  "properties": [
    {
      "name": "applicationType",
      "labels": {
        "fr": "Type d’application",
        "en": "Application type"
      },
      "kind": "enum",
      "overridable": false,
      "default": "web",
      "values": [
        "web",
        "other"
      ],
      "lockedAfterPublish": true
    },
    {
      "name": "samplingPercentage",
      "labels": {
        "fr": "Échantillonnage à l’ingestion (%)",
        "en": "Ingestion sampling (%)"
      },
      "kind": "number",
      "overridable": true,
      "default": 100,
      "minimum": 0.1,
      "maximum": 100
    },
    {
      "name": "disableLocalAuth",
      "labels": {
        "fr": "Désactiver l’authentification locale",
        "en": "Disable local authentication"
      },
      "kind": "boolean",
      "overridable": true,
      "default": false
    }
  ],
  "fixedValues": [],
  "children": [],
  "identities": {
    "system": false,
    "userAssignedMax": 0
  },
  "links": {
    "asSource": [
      "Logging"
    ],
    "asTarget": [
      "Telemetry"
    ],
    "required": [
      {
        "kind": "Logging",
        "cardinality": "one"
      }
    ]
  },
  "outputs": [
    {
      "name": "connectionString",
      "description": "Chaîne de connexion Application Insights, non secrète.",
      "sensitive": false,
      "computableFromName": false
    },
    {
      "name": "id",
      "description": "Identifiant de la ressource.",
      "sensitive": false,
      "computableFromName": false
    }
  ],
  "lifecycle": {
    "family": "data"
  },
  "roles": [
    "Monitoring Metrics Publisher",
    "Application Insights Component Contributor",
    "Monitoring Reader"
  ],
  "roleEquivalences": {},
  "dataAccess": {
    "supported": false,
    "levels": [],
    "databaseEngine": null
  },
  "exposure": {
    "modes": [],
    "privateGroupIds": [],
    "privateDnsZones": [],
    "conditions": []
  },
  "diagnostics": {
    "supported": true
  },
  "applicationSettings": {
    "destination": "none"
  },
  "languageSupport": {
    "Bicep": "full",
    "Terraform": "none",
    "Pulumi": "none"
  },
  "generation": {
    "Bicep": {
      "module": "br/public:avm/res/insights/component:0.8.0",
      "versionPin": "0.8.0",
      "map": {
        "applicationType": "applicationType",
        "samplingPercentage": "samplingPercentage",
        "disableLocalAuth": "disableLocalAuth",
        "workspaceResourceId": "workspaceResourceId"
      }
    }
  },
  "deprecations": [],
  "privateDnsZones": [],
  "requiredNetworkRules": [],
  "recommendedAlerts": [],
  "pricing": {
    "source": "azure-retail-prices",
    "meters": [
      {
        "serviceName": "Azure Monitor",
        "productName": "Application Insights",
        "meterName": "Data processed"
      }
    ],
    "assumptions": [],
    "estimated": false,
    "unestimatedReason": "Aucun scénario tarifaire par défaut n’est estimé pour le profil du pilote."
  },
  "drift": []
}
