{
  "type": "ContainerAppsEnvironment",
  "labels": {
    "fr": "Environnement Container Apps",
    "en": "Container Apps environment"
  },
  "category": "compute",
  "icon": "container-apps-environment",
  "armType": "Microsoft.App/managedEnvironments",
  "availableFrom": "lot1",
  "documentationUrl": "https://learn.microsoft.com/en-us/azure/templates/microsoft.app/managedenvironments",
  "verifiedAgainstDocsOn": "2026-10-27",
  "naming": {
    "abbreviation": "cae",
    "allowed": "^[a-z][a-z0-9-]{0,30}[a-z0-9]$",
    "case": "lower",
    "separators": [
      "-"
    ],
    "forbidConsecutiveSeparators": true,
    "minLength": 2,
    "maxLength": 32,
    "firstChar": "letter",
    "lastChar": "alphanumeric",
    "uniqueness": "resourceGroup",
    "availabilityDomain": null
  },
  "properties": [
    {
      "name": "workloadProfiles",
      "labels": {
        "fr": "Profils de charge dédiés",
        "en": "Dedicated workload profiles"
      },
      "kind": "array",
      "overridable": true,
      "default": []
    },
    {
      "name": "zoneRedundant",
      "labels": {
        "fr": "Redondance de zone",
        "en": "Zone redundancy"
      },
      "kind": "boolean",
      "overridable": false,
      "default": false,
      "lockedAfterPublish": true,
      "condition": "requires:virtualNetworkConfiguration"
    }
  ],
  "fixedValues": [],
  "children": [],
  "identities": {
    "system": false,
    "userAssignedMax": 0
  },
  "links": {
    "asSource": [
      "Logging"
    ],
    "asTarget": [
      "Hosting"
    ],
    "required": []
  },
  "outputs": [
    {
      "name": "id",
      "description": "Identifiant de la ressource.",
      "sensitive": false,
      "computableFromName": false
    },
    {
      "name": "defaultDomain",
      "description": "Domaine DNS par défaut.",
      "sensitive": false,
      "computableFromName": false
    },
    {
      "name": "staticIp",
      "description": "Adresse IP statique.",
      "sensitive": false,
      "computableFromName": false
    }
  ],
  "lifecycle": {
    "family": "data"
  },
  "roles": [
    "Contributor",
    "Reader"
  ],
  "roleEquivalences": {},
  "dataAccess": {
    "supported": false,
    "levels": [],
    "databaseEngine": null
  },
  "exposure": {
    "modes": [],
    "privateGroupIds": [],
    "privateDnsZones": [],
    "conditions": []
  },
  "diagnostics": {
    "supported": true
  },
  "applicationSettings": {
    "destination": "none"
  },
  "languageSupport": {
    "Bicep": "full",
    "Terraform": "none",
    "Pulumi": "none"
  },
  "generation": {
    "Bicep": {
      "module": "br/public:avm/res/app/managed-environment:0.16.0",
      "versionPin": "0.16.0",
      "map": {
        "workloadProfiles": "workloadProfiles",
        "zoneRedundant": "zoneRedundant",
        "appLogsConfiguration": "appLogsConfiguration"
      }
    }
  },
  "deprecations": [],
  "privateDnsZones": [],
  "requiredNetworkRules": [],
  "recommendedAlerts": [],
  "pricing": {
    "source": "azure-retail-prices",
    "meters": [
      {
        "serviceName": "Azure Container Apps",
        "productName": "Dedicated workload profiles",
        "meterName": "vCPU seconds"
      }
    ],
    "assumptions": [],
    "estimated": false,
    "unestimatedReason": "Aucun scénario tarifaire par défaut n’est estimé pour le profil du pilote."
  },
  "drift": []
}
